{
  "id": "menu-slot-roll-image-wall",
  "title": "Menu slot roll into a drifting image wall",
  "summary": "A one-line claim types in on pale grey, a sidebar menu rolls entry by entry like a slot drum, spins and lands on one entry, the camera pushes into it, a three-column image wall drifts up, and one card grows into a dimmed closing frame.",
  "use_when": [
    "A tool or library with a long feature list where one category is the differentiator",
    "A 15 to 20 s vertical reel narrated by VO, one claim per beat",
    "The product owns a strong image set that can carry the second half",
    "Moving from a calm light UI opening to a moody full-bleed close"
  ],
  "source": {
    "name": "raylight",
    "url": "https://www.raylight.app/templates/nEAFYmnY",
    "author": "Amelie Roesmann",
    "ref_id": "rl-056"
  },
  "family": "social-promo",
  "tags": [
    "vertical",
    "slot-roll",
    "menu",
    "image-wall",
    "gallery",
    "light-to-dark",
    "voice-over",
    "end-card",
    "tagline",
    "asset-library"
  ],
  "techniques": [
    "word-reveal",
    "blur-dissolve",
    "stacked-roll",
    "push-in",
    "hard-cut",
    "dolly",
    "scrim",
    "end-card"
  ],
  "format": {
    "aspect": "9:16",
    "duration_s": 18.43,
    "fps": 30,
    "loopable": false
  },
  "look": {
    "theme": "mixed",
    "palette": [
      "#F5F7F2",
      "#1A1D19",
      "#939591",
      "#E5E7E3",
      "#3A2918",
      "#776E60"
    ],
    "type_style": "medium grotesk, sentence case, normal tracking; statement ~4 % H centred, menu entries ~2.5 % H with a line icon; close line ~4 % H, white, key words in bold",
    "treatment": [
      "scrim"
    ]
  },
  "audio": {
    "vo": true,
    "music": {
      "present": true,
      "bpm": 91.7,
      "energy": "calm",
      "genre": null,
      "cut_on_beat": false
    },
    "sfx": [
      {
        "event": "menu entry clicks into the centre slot",
        "sound": "tick"
      },
      {
        "event": "fast drum spin",
        "sound": "whoosh"
      },
      {
        "event": "push into the landed entry and cut to the wall",
        "sound": "swoosh-short"
      },
      {
        "event": "card grows to full frame",
        "sound": "swell"
      },
      {
        "event": "mark petals assemble",
        "sound": "pop"
      }
    ]
  },
  "structure": [
    {
      "t0": 0,
      "t1": 2.27,
      "beat": "hook",
      "shot": "small brand mark top centre on pale grey; a 7-word claim on two lines, names the sameness problem",
      "camera": "drift 1.00->1.02 over 68 fr, easings.linear",
      "motion": "word-reveal from 0.27 s, ~3 fr per word (±0.25 s), each word light grey -> ink over ~8 fr (±0.25 s), easings.outExpo; complete at 1.00 s, holds 30 fr",
      "transition_out": "blur-dissolve",
      "sfx": ""
    },
    {
      "t0": 2.27,
      "t1": 6.27,
      "beat": "problem",
      "shot": "vertical menu drum: centre entry in ink with a line icon, one faded neighbour above and below; generic categories",
      "camera": "locked frame, no scale or pan; only the drum content moves",
      "motion": "drum steps one entry roughly every 30 fr, each step <= 8 fr (±0.25 s) springs.ui (overshoot not measurable); neighbours fade to ~20 % opacity at ±10 % H; each landing meets the VO naming it",
      "transition_out": "continuous",
      "sfx": "tick"
    },
    {
      "t0": 6.27,
      "t1": 7.27,
      "beat": "tension",
      "shot": "the same drum spins fast: a new pair of entries in every cell, slot-machine style",
      "camera": "locked frame, no scale or pan; only the drum content moves",
      "motion": "spin ~4 entries per 0.25 s, decelerating, easings.outExpo 30 fr; lands on the hero entry at 7.27, settled by 7.50",
      "transition_out": "continuous",
      "sfx": "whoosh"
    },
    {
      "t0": 7.27,
      "t1": 8.9,
      "beat": "reveal",
      "shot": "drum at rest on the hero entry (the image category), neighbours faded",
      "camera": "hold 38 fr, then push-in 1.00->~1.40 over ~11 fr (±0.25 s), easings.inExpo, cut while still accelerating",
      "motion": "none besides the push; neighbours keep their ~20 % opacity",
      "transition_out": "hard-cut",
      "sfx": "swoosh-short"
    },
    {
      "t0": 8.9,
      "t1": 12.27,
      "beat": "feature",
      "shot": "three-column wall of rounded image cards, columns offset, pale gutters; white capsule with mark and name at the top",
      "camera": "dolly up ~2.4 px/fr at 720 w (~6.3 px/fr at 1920), easings.linear; scale drift 1.00->0.93 over 101 fr",
      "motion": "capsule fades and un-blurs 9.00->9.50 (~12 fr, ±0.25 s), easings.outExpo; all columns travel together (parallax not measurable)",
      "transition_out": "continuous",
      "sfx": ""
    },
    {
      "t0": 12.27,
      "t1": 12.77,
      "beat": "feature",
      "shot": "one portrait card in the middle column grows over its neighbours until it fills the frame",
      "camera": "locked frame; the card scales, the camera does not",
      "motion": "capsule fades out 12.00->12.27; card scale 1 -> ~3.3 and corner radius -> 0 over ~15 fr (±0.25 s), springs.ui (overshoot not measurable); image then dims to ~45 % by 12.77",
      "transition_out": "continuous",
      "sfx": "swell"
    },
    {
      "t0": 12.77,
      "t1": 15.77,
      "beat": "logo",
      "shot": "full-bleed dimmed portrait; white petal mark upper third with the wordmark below",
      "camera": "drift 1.00->1.015 over 90 fr, easings.linear",
      "motion": "petals pop in one by one from 13.00, stagger ~4 fr (±0.25 s), springs.ui (overshoot not measurable), mark whole at 13.77; wordmark grey -> white fade 13.50->13.77 (~8 fr); hold 51 fr; both fade 15.50->15.77 (~8 fr)",
      "transition_out": "blur-dissolve",
      "sfx": "pop"
    },
    {
      "t0": 15.77,
      "t1": 18.43,
      "beat": "outro",
      "shot": "same dimmed portrait; a 9-word closing promise on two lines, second line half in bold",
      "camera": "drift 1.00->1.005, easings.linear",
      "motion": "word-reveal synced to VO: 3 words at 15.77, line 1 done by 16.00, line 2 from 16.77, complete at 17.00; each word ~8 fr fade (±0.25 s) easings.outExpo; holds 43 fr to the end",
      "transition_out": "end",
      "sfx": ""
    }
  ],
  "inputs": {
    "product_name": true,
    "logo": true,
    "tagline": true,
    "lines": 2,
    "screenshots": 15,
    "screen_recording": false,
    "ui_rebuild": false,
    "stats": 0,
    "url": true
  },
  "components": [
    "WordReveal",
    "StackedRoll",
    "Dolly",
    "KenBurns",
    "Scrim",
    "EndCard",
    "BrandProvider",
    "ASPECTS"
  ],
  "params": {
    "brand": "brand.json: bg (pale grey), fg ink, muted, mark SVG, display font",
    "content.hook": "one claim, <= 8 words, two lines, names the problem",
    "content.menu": "10-16 entries {icon, label}; the generic ones first, the hero entry last",
    "content.heroEntry": "the entry the spin lands on (index into menu)",
    "content.images": "12-18 portrait/landscape images for the three-column wall; one marked as the closing image",
    "content.name": "product name or domain shown in the capsule and under the mark",
    "content.close": "closing promise, <= 10 words, two lines, words to bold",
    "timing.vo": "word timings to land each drum step and each word of the close",
    "aspect": "9:16 native; 4:5 keeps three columns, 16:9 needs five"
  },
  "difficulty": "medium",
  "render_cost": "light",
  "notes": "Measured from 4 fps sheets (±0.25 s). Only one detected cut (8.90, 4.7 fr from the nearest beat): cut_on_beat 0/1. The opening text-to-menu change at 2.27 and the card growth at 12.27 are continuous moves the detector does not count. Drum steps follow the VO naming each category, not the music. The push into the landed entry accelerates into the hard cut (inExpo), unlike a slow push-in. Proposed terms (not used as ids): menu-drum, card-expand-fill, petal-assemble. sfx planned by the glue rule, not measured.",
  "status": "studied"
}
